{
  "$schema": "https://json-schema.org/draft/2020-12/schema",
  "$id": "https://cyberdeck.shishir.com/schemas/documents/layout.schema.json",
  "title": "CyberDeck Published Layout Document (cyberdeck.layout)",
  "description": "Player-facing flattened projection of a cyberdeck.project, produced engine-side at publish (Q2 default): components/variants resolved, bindings reduced to state bindings + value rules, frames snapped to the grid. Pages mirror the existing player render model (client/lib/render/model.dart) field-for-field. CD-111.",
  "type": "object",
  "required": ["format", "version", "device", "pages"],
  "additionalProperties": false,
  "$defs": {
    "stableId": {
      "type": "string",
      "pattern": "^[a-z][a-z0-9]*_[a-z0-9][a-z0-9-]{5,}$"
    },
    "placement": {
      "type": "object",
      "required": ["col", "row"],
      "additionalProperties": false,
      "properties": {
        "col": { "type": "integer", "minimum": 0 },
        "row": { "type": "integer", "minimum": 0 },
        "colSpan": { "type": "integer", "minimum": 1, "default": 1 },
        "rowSpan": { "type": "integer", "minimum": 1, "default": 1 }
      }
    },
    "appearance": {
      "type": "object",
      "additionalProperties": false,
      "properties": {
        "style": { "type": "object", "additionalProperties": true },
        "stateBinding": {
          "type": "string",
          "description": "state id this widget follows (bindings with mode=variable flatten to this)"
        },
        "valueRules": {
          "type": "array",
          "items": {},
          "description": "client-side value → presentation rules (expressions flatten into these where possible)"
        }
      }
    },
    "widget": {
      "type": "object",
      "required": ["id", "type", "placement"],
      "additionalProperties": false,
      "properties": {
        "id": {
          "$ref": "#/$defs/stableId",
          "description": "same stable id as the authoring instance (component instances get deterministic expanded ids — see ID_AND_FLATTEN.md)"
        },
        "type": { "type": "string", "pattern": "^[a-z][a-z0-9]*(\\.[a-z][a-z0-9-]*)+$" },
        "placement": { "$ref": "#/$defs/placement" },
        "appearance": { "$ref": "#/$defs/appearance" },
        "interaction": {
          "type": "object",
          "additionalProperties": true,
          "description": "gesture → action ref (project events registry flattens here)"
        },
        "config": { "type": "object", "additionalProperties": true }
      }
    },
    "grid": {
      "type": "object",
      "additionalProperties": false,
      "properties": {
        "columns": { "type": "integer", "minimum": 1, "default": 24 },
        "rows": { "type": "integer", "minimum": 1, "default": 18 },
        "gutter": { "type": "number", "minimum": 0, "default": 8 },
        "marginX": { "type": "number", "minimum": 0, "default": 16 },
        "marginY": { "type": "number", "minimum": 0, "default": 16 },
        "background": { "type": "object", "additionalProperties": true },
        "deviceClass": { "type": "string" }
      }
    }
  },
  "properties": {
    "format": { "const": "cyberdeck.layout" },
    "version": {
      "type": "integer",
      "minimum": 1,
      "description": "monotonic publish revision for this device (players compare to detect staleness)"
    },
    "projectId": { "$ref": "#/$defs/stableId" },
    "publishedAt": {
      "type": "string",
      "pattern": "^\\d{4}-\\d{2}-\\d{2}T\\d{2}:\\d{2}:\\d{2}(\\.\\d+)?(Z|[+-]\\d{2}:\\d{2})$"
    },
    "device": {
      "type": "object",
      "required": ["deviceClass"],
      "additionalProperties": false,
      "properties": {
        "id": { "$ref": "#/$defs/stableId" },
        "name": { "type": "string" },
        "deviceClass": { "type": "string", "minLength": 1 }
      }
    },
    "pages": {
      "type": "array",
      "minItems": 1,
      "items": {
        "type": "object",
        "required": ["id", "widgets"],
        "additionalProperties": false,
        "description": "mirrors client LayoutPage: id + grid + widgets + version",
        "properties": {
          "id": { "$ref": "#/$defs/stableId" },
          "name": { "type": "string" },
          "grid": { "$ref": "#/$defs/grid" },
          "version": { "type": "integer", "minimum": 0, "default": 0 },
          "widgets": { "type": "array", "items": { "$ref": "#/$defs/widget" } }
        }
      }
    }
  }
}
